{
  "$id": "https://posthog-impact.local/schemas/comments.schema.json",
  "$schema": "https://json-schema.org/draft/2020-12/schema",
  "additionalProperties": false,
  "properties": {
    "author_actor_id": {
      "arrow_type": "string",
      "type": [
        "string",
        "null"
      ]
    },
    "author_login": {
      "arrow_type": "string",
      "type": [
        "string",
        "null"
      ]
    },
    "author_typename": {
      "arrow_type": "string",
      "type": [
        "string",
        "null"
      ]
    },
    "body_length": {
      "arrow_type": "int64",
      "type": [
        "integer",
        "null"
      ]
    },
    "body_text": {
      "arrow_type": "string",
      "type": [
        "string",
        "null"
      ]
    },
    "comment_id": {
      "arrow_type": "string",
      "type": [
        "string",
        "null"
      ]
    },
    "computed_at": {
      "arrow_type": "string",
      "type": [
        "string",
        "null"
      ]
    },
    "created_at": {
      "arrow_type": "string",
      "type": [
        "string",
        "null"
      ]
    },
    "database_id": {
      "arrow_type": "int64",
      "type": [
        "integer",
        "null"
      ]
    },
    "parent_id": {
      "arrow_type": "string",
      "type": [
        "string",
        "null"
      ]
    },
    "parent_kind": {
      "arrow_type": "string",
      "type": [
        "string",
        "null"
      ]
    },
    "parent_number": {
      "arrow_type": "int64",
      "type": [
        "integer",
        "null"
      ]
    },
    "updated_at": {
      "arrow_type": "string",
      "type": [
        "string",
        "null"
      ]
    },
    "url": {
      "arrow_type": "string",
      "type": [
        "string",
        "null"
      ]
    }
  },
  "title": "comments",
  "type": "object",
  "x-pipeline-version": "1.0.0",
  "x-schema-version": "1.0.0"
}
