[
  {
    "author_actor_id": "github/user/yakkomajuri",
    "author_login": "yakkomajuri",
    "author_typename": "User",
    "body_length": 38,
    "body_text": "@posthog-bot please add @Bla for ideas",
    "comment_id": "IC_kwDODg-Tdc4_bg_X",
    "computed_at": "2026-08-17T14:45:38.551298Z",
    "created_at": "2022-03-10T15:22:13Z",
    "database_id": null,
    "parent_id": "github.com/PostHog/posthog#issue/1",
    "parent_kind": "issue",
    "parent_number": 1,
    "updated_at": null,
    "url": "https://github.com/PostHog/posthog/issues/1#issuecomment-1064177623"
  },
  {
    "author_actor_id": "github/user/posthog-contributions-bot",
    "author_login": "posthog-contributions-bot",
    "author_typename": "Bot",
    "body_length": 76,
    "body_text": "@yakkomajuri\nWe had trouble processing your request. Please try again later.",
    "comment_id": "IC_kwDODg-Tdc4_bg_m",
    "computed_at": "2026-08-17T14:45:38.551319Z",
    "created_at": "2022-03-10T15:22:14Z",
    "database_id": null,
    "parent_id": "github.com/PostHog/posthog#issue/1",
    "parent_kind": "issue",
    "parent_number": 1,
    "updated_at": null,
    "url": "https://github.com/PostHog/posthog/issues/1#issuecomment-1064177638"
  },
  {
    "author_actor_id": "github/user/yakkomajuri",
    "author_login": "yakkomajuri",
    "author_typename": "User",
    "body_length": 37,
    "body_text": "@posthog-bot please add @Bla for idea",
    "comment_id": "IC_kwDODg-Tdc4_bhpa",
    "computed_at": "2026-08-17T14:45:38.551324Z",
    "created_at": "2022-03-10T15:24:40Z",
    "database_id": null,
    "parent_id": "github.com/PostHog/posthog#issue/1",
    "parent_kind": "issue",
    "parent_number": 1,
    "updated_at": null,
    "url": "https://github.com/PostHog/posthog/issues/1#issuecomment-1064180314"
  },
  {
    "author_actor_id": "github/user/posthog-contributions-bot",
    "author_login": "posthog-contributions-bot",
    "author_typename": "Bot",
    "body_length": 54,
    "body_text": "@yakkomajuri\nI've put up a pull request to add @Bla! \ud83c\udf89",
    "comment_id": "IC_kwDODg-Tdc4_bhr1",
    "computed_at": "2026-08-17T14:45:38.551333Z",
    "created_at": "2022-03-10T15:24:49Z",
    "database_id": null,
    "parent_id": "github.com/PostHog/posthog#issue/1",
    "parent_kind": "issue",
    "parent_number": 1,
    "updated_at": null,
    "url": "https://github.com/PostHog/posthog/issues/1#issuecomment-1064180469"
  },
  {
    "author_actor_id": "github/user/jamesefhawkins",
    "author_login": "jamesefhawkins",
    "author_typename": "User",
    "body_length": 76,
    "body_text": "We've done this except for the spend, which we are moving away from for now.",
    "comment_id": "MDEyOklzc3VlQ29tbWVudDU4OTkyMDgwNw==",
    "computed_at": "2026-08-17T14:45:38.551281Z",
    "created_at": "2020-02-22T05:28:26Z",
    "database_id": null,
    "parent_id": "github.com/PostHog/posthog#issue/1",
    "parent_kind": "issue",
    "parent_number": 1,
    "updated_at": null,
    "url": "https://github.com/PostHog/posthog/issues/1#issuecomment-589920807"
  },
  {
    "author_actor_id": "github/user/kaumah",
    "author_login": "KauMah",
    "author_typename": "User",
    "body_length": 645,
    "body_text": "Hey, proposition for a solution here:\n\nCreate a legend for the graph where checking/unchecking and rearranging happens\nThe order of user groups (new, resurrecting, etc) on the legend would be reflecte",
    "comment_id": "IC_kwDODg-Tdc5f_ldx",
    "computed_at": "2026-08-17T14:45:38.551644Z",
    "created_at": "2023-06-28T01:57:16Z",
    "database_id": null,
    "parent_id": "github.com/PostHog/posthog#issue/14579",
    "parent_kind": "issue",
    "parent_number": 14579,
    "updated_at": null,
    "url": "https://github.com/PostHog/posthog/issues/14579#issuecomment-1610504049"
  },
  {
    "author_actor_id": "github/user/quantum0uasar",
    "author_login": "Quantum0uasar",
    "author_typename": "User",
    "body_length": 602,
    "body_text": "Hi! I'd love to take a stab at this one.\nMy plan:\n\nAdd a drag-to-reorder UI to the Lifecycle chart legend, allowing users to reorder the series (New, Returning, Resurrecting, Dormant)\nPersist the orde",
    "comment_id": "IC_kwDODg-Tdc8AAAABDHqLlg",
    "computed_at": "2026-08-17T14:45:38.551666Z",
    "created_at": "2026-05-21T02:46:38Z",
    "database_id": null,
    "parent_id": "github.com/PostHog/posthog#issue/14579",
    "parent_kind": "issue",
    "parent_number": 14579,
    "updated_at": null,
    "url": "https://github.com/PostHog/posthog/issues/14579#issuecomment-4504325014"
  },
  {
    "author_actor_id": "github/user/chakravarthi-roy",
    "author_login": "Chakravarthi-roy",
    "author_typename": "User",
    "body_length": 334,
    "body_text": "Hi! I went through PR #16542 and understood what was merged, which is the fixed default order. I'd like to implement the remaining part like allowing users to reorder the lifecycle series (without dra",
    "comment_id": "IC_kwDODg-Tdc8AAAABEaqTJw",
    "computed_at": "2026-08-17T14:45:38.551675Z",
    "created_at": "2026-06-01T09:40:43Z",
    "database_id": null,
    "parent_id": "github.com/PostHog/posthog#issue/14579",
    "parent_kind": "issue",
    "parent_number": 14579,
    "updated_at": null,
    "url": "https://github.com/PostHog/posthog/issues/14579#issuecomment-4591358759"
  },
  {
    "author_actor_id": "github/user/corywatilo",
    "author_login": "corywatilo",
    "author_typename": "User",
    "body_length": 218,
    "body_text": "Two more things that can't be done today:\n1. Combining classes\nThese work (individually):\n\n.text-sm\n.text-center\n\nThis doesn't:\n\n.text-sm.text-center\n\n2. Cascading DOM elements\nThis doesn't work:\n\n.te",
    "comment_id": "IC_kwDODg-Tdc5--OnJ",
    "computed_at": "2026-08-17T14:45:38.551722Z",
    "created_at": "2024-05-24T19:37:44Z",
    "database_id": null,
    "parent_id": "github.com/PostHog/posthog#issue/15480",
    "parent_kind": "issue",
    "parent_number": 15480,
    "updated_at": null,
    "url": "https://github.com/PostHog/posthog/issues/15480#issuecomment-2130241993"
  },
  {
    "author_actor_id": "github/user/corywatilo",
    "author_login": "corywatilo",
    "author_typename": "User",
    "body_length": 216,
    "body_text": "Related...\nWhen trying to define an action using the toolbar, it can correctly read the classes and loads them into the selector field...\n\n... but trying to save an event with non-supported selectors ",
    "comment_id": "IC_kwDODg-Tdc5oylh3",
    "computed_at": "2026-08-17T14:45:38.551717Z",
    "created_at": "2023-10-11T16:44:09Z",
    "database_id": null,
    "parent_id": "github.com/PostHog/posthog#issue/15480",
    "parent_kind": "issue",
    "parent_number": 15480,
    "updated_at": null,
    "url": "https://github.com/PostHog/posthog/issues/15480#issuecomment-1758091383"
  },
  {
    "author_actor_id": "github/user/pauldambra",
    "author_login": "pauldambra",
    "author_typename": "User",
    "body_length": 329,
    "body_text": "another I spotted while looking at https://posthoghelp.zendesk.com/agent/tickets/28216\nwe generate valid css matching like [data-attr=\"session\\.recording\\.preview\"] but the action matcher when queryin",
    "comment_id": "IC_kwDODg-Tdc6l_LwY",
    "computed_at": "2026-08-17T14:45:38.551731Z",
    "created_at": "2025-04-07T22:50:27Z",
    "database_id": null,
    "parent_id": "github.com/PostHog/posthog#issue/15480",
    "parent_kind": "issue",
    "parent_number": 15480,
    "updated_at": null,
    "url": "https://github.com/PostHog/posthog/issues/15480#issuecomment-2784803864"
  },
  {
    "author_actor_id": "github/user/ordehi",
    "author_login": "ordehi",
    "author_typename": "User",
    "body_length": 168,
    "body_text": "Another example here, the selector was taken from the toolbar: https://posthoghelp.zendesk.com/agent/tickets/28761\n.\u03c1d__all > .\u03c1d__all > .\u03c1d__all .\u03c1d__all .rounded-full",
    "comment_id": "IC_kwDODg-Tdc6mtq0E",
    "computed_at": "2026-08-17T14:45:38.551742Z",
    "created_at": "2025-04-11T13:55:33Z",
    "database_id": null,
    "parent_id": "github.com/PostHog/posthog#issue/15480",
    "parent_kind": "issue",
    "parent_number": 15480,
    "updated_at": null,
    "url": "https://github.com/PostHog/posthog/issues/15480#issuecomment-2796989700"
  },
  {
    "author_actor_id": "github/user/bs1180",
    "author_login": "bs1180",
    "author_typename": "User",
    "body_length": 89,
    "body_text": "The selector nth-of-type also doesn't work for creating an action:\n\nInternal conversation",
    "comment_id": "IC_kwDODg-Tdc7XDFiI",
    "computed_at": "2026-08-17T14:45:38.551767Z",
    "created_at": "2025-12-03T17:12:59Z",
    "database_id": null,
    "parent_id": "github.com/PostHog/posthog#issue/15480",
    "parent_kind": "issue",
    "parent_number": 15480,
    "updated_at": null,
    "url": "https://github.com/PostHog/posthog/issues/15480#issuecomment-3607910536"
  },
  {
    "author_actor_id": "github/user/pranjalg13",
    "author_login": "pranjalg13",
    "author_typename": "User",
    "body_length": 731,
    "body_text": "async function deleteFlag(featureFlagKey: string): Promise<void> {\n    // Soft delete the flag\n    await db.postgresQuery('UPDATE posthog_featureflag SET is_deleted = true WHERE feature_flag_key = $1'",
    "comment_id": "IC_kwDODg-Tdc5jiejK",
    "computed_at": "2026-08-17T14:45:38.551801Z",
    "created_at": "2023-08-08T16:56:18Z",
    "database_id": null,
    "parent_id": "github.com/PostHog/posthog#issue/16885",
    "parent_kind": "issue",
    "parent_number": 16885,
    "updated_at": null,
    "url": "https://github.com/PostHog/posthog/issues/16885#issuecomment-1669982410"
  },
  {
    "author_actor_id": "github/user/haacked",
    "author_login": "haacked",
    "author_typename": "User",
    "body_length": 36,
    "body_text": "We can use Dagster to clean this up.",
    "comment_id": "IC_kwDODg-Tdc6vj51u",